<?xml version='1.0' encoding='UTF-8' standalone='no' ?>
<!DOCTYPE PrivateLabels SYSTEM "private.dtd" >

<PrivateLabels i18nPackage="org.opengts.db">

<!--
  =======================================================================================
  Project: OpenGTS - Open GPS Tracking System
  URL    : http://www.opengts.org
  File   : private.xml
  =======================================================================================
  Notes:
    - The data format of this XML file is subject to change.
    - A general tutorial on XML syntax can be found at "http://en.wikipedia.org/wiki/Xml"
    - Value substitution variables are now in use in some values defined in this file.
      They appear in the form "${Variable=defaultValue}", where "Variable" is a runtime
      variable defined in one of the runtime property files ("default.conf","webapp.conf",
      or "common.conf", etc), and "defaultValue" is the value to use for the substitution
      if the named "Variable" is not found in the loaded runtime configuration files.
      In all cases where you find "${Variable=defaultValue}", you can replace this sequence
      with your own customized value "myValue".  For instance, the "locale" attribute
      on the "Domain" tag currently specifies the following:
         locale="en"
      If you wanted to set the current locale to Spanish, you replace this value with
         locale="es"
    - For "Property" tag specifications (parent tags "Properties", "MapProvider", and
      "ReverseGeocodeProvider"), the key/value may be overidden in the 'config.conf' file.
      The parent for the specified "Property" tag will contain an attribute "rtPropPrefix"
      The value of this attribute indicates the property key prefix that can be used to
      identify a specific property override in the 'config.conf' file.  For instance,
      the following property specification exists below:
        <Properties rtPropPrefix="Domain.Properties.">
           ...
           <Property key="topMenu.showMenuHelp">true</Property>
           ...
        </Properties>
      This means that the property value can be overidden in a 'config.conf' as follows:
        Domain.Properties.topMenu.showMenuHelp=false
  =======================================================================================
  Change History:
   2008/02/07  Martin D. Flynn
      -Added 'i18n' attributes to displayable text to allow Localization.
   2008/02/21  Martin D. Flynn
      -Under the 'Domain' tag, replaced 'dateFormat' attribute with 'DateFormat' tag.
      -Under the 'Domain' tag, replaced 'timeFormat' attribute with 'TimeFormat' tag.
      -Added a few Europian timezones.
   2008/04/11  Martin D. Flynn
      -Modified MapProvider to allow specifying property key/values in separate tags.
   2008/05/14  Martin D. Flynn
      -Modified ReverseGeocodeProvider to allow specifying property key/val in separate tags.
      -Added parent 'EMailAddresses' tag to 'EMailAddress' tags.
   2008/06/20  Martin D. Flynn
      -Added MapProvider section for Mapstraction support.
   2008/07/08  Martin D. Flynn
      -Additional changes to mapping support (Mapstraction, OpenLayers, etc).
   2008/07/21  Martin D. Flynn
      -The PageDecorations tag is now obsolete and has been removed from this 'private.xml'.
       Page decorations are now handled by the JSP file at "war/track/jsp/loginSession.jsp".
      -The attribute 'jsp' has been added to 'WebPages' and 'Pages' tags to allow specifying
       a JSP to control the page look-and-feel.
   2008/07/27  Martin D. Flynn
      -Added 'Pushpins' tag section to parent 'MapProvider' tag.
   2008/08/15  Martin D. Flynn
      -Added Acl tag 'maximum' (was 'access') and 'default' attirbutes.
   2008/09/12  Martin D. Flynn
      -Added Domain properties "trackMap.showTimezoneSelection", "trackMap.showLastLocation"
   2008/09/19  Martin D. Flynn
      -Added "map.view" property support to MapProvider properties.
      -Replaced property "trackMap.showLastLocation" with "trackMap.showUpdateLast".
   2008/10/16  Martin D. Flynn
      -Simplified ACL usage (attribute "maximum" changed to "values", reduced number of ACLs).
      -Added additional Domain Properties 
   2008/12/01  Martin D. Flynn
      -Global Domain Property tags have now been placed in a "Properties" parent tag.
   2009/01/01  Martin D. Flynn
      -Added Calendar property "calendar.firstDayOfWeek".
   2009/02/01  Martin D. Flynn
      -Added "<I18N>" tag section.
   2009/02/20  Martin D. Flynn
      -Various tag attribute and body-values may now have a value specification that resembles
       something like "${Domain.key=defaultValue}".  This means that when the value for this
       attribute or tag body is evaluated, it will first attempt to obtain the value from
       the runtime property definition file (ie. default.conf, webapp.conf, or common.conf).
       If the specified key is not found in the runtime property files, then the value
       specified for 'default' will be returned.
   2009/05/01  Martin D. Flynn
      -Added "StatusCodes" section for overriding the default status code descriptions.
   2009/08/23  Martin D. Flynn
      -Added "Legend" and "IconSelector" tags to MapProvider
   2009/09/23  Martin D. Flynn
      -Removed "${Domain....=}" variable substitution (to simplify configuration of open-source version)
   2010/01/28  Martin D. Flynn
      -Move Pushpins to common global area
   2010/10/13  Martin D. Flynn
      -Added SupportedLocales
  =======================================================================================
-->

<!-- ==================================================================================== -->
<!-- Supported Locales  ================================================================= -->
<!-- This list is used to populate the language selection pull-down menu on the login page.
 === To display the language selection pull-down menu on the login page, make sure that the
 === property "accountLogin.showLocaleSelection" is set to true.
 -->
<SupportedLocales>
<!-- Locale id="ar" i18n="PrivateXML.locale.arabic"    >Arabic</Locale -->
    <Locale id="en" i18n="PrivateXML.locale.english"   >English</Locale>
    <Locale id="fr" i18n="PrivateXML.locale.french"    >French</Locale>
    <Locale id="de" i18n="PrivateXML.locale.german"    >German</Locale>
    <Locale id="el" i18n="PrivateXML.locale.greek"     >Greek</Locale>
    <Locale id="hu" i18n="PrivateXML.locale.hungarian" >Hungarian</Locale>
    <Locale id="it" i18n="PrivateXML.locale.italian"   >Italian</Locale>
<!-- Locale id="lo" i18n="PrivateXML.locale.lao"       >Lao</Locale -->
    <Locale id="nl" i18n="PrivateXML.locale.dutch"     >Dutch</Locale>
    <Locale id="pl" i18n="PrivateXML.locale.polish"    >Polish</Locale>
    <Locale id="pt" i18n="PrivateXML.locale.portuguese">Portuguese</Locale>
    <Locale id="ro" i18n="PrivateXML.locale.romanian"  >Romanian</Locale>
    <Locale id="ru" i18n="PrivateXML.locale.russian"   >Russian</Locale>
    <Locale id="sk" i18n="PrivateXML.locale.slovak"    >Slovak</Locale>
    <Locale id="sr" i18n="PrivateXML.locale.serbian"   >Serbian</Locale>
    <Locale id="es" i18n="PrivateXML.locale.spanish"   >Spanish</Locale>
    <Locale id="tr" i18n="PrivateXML.locale.turkish"   >Turkish</Locale>
</SupportedLocales>

<!-- TimeZones  ========================================================================= -->
<!-- References:
====   http://wwp.greenwichmeantime.com/info/timezone.htm
====   http://www.worldtimezone.com
==== A list of available timezones can be found in the file 'timezones.conf'
==== These TimeZones will be shared among all of the specified PrivateLabel Domains 
-->
<TimeZones>
    US/Hawaii  US/Alaska  US/Pacific  US/Arizona  US/Mountain  US/Central  US/Eastern
    Canada/Pacific  Canada/Mountain  Canada/Central  Canada/Eastern  Canada/Atlantic
    Mexico/BajaNorte  Mexico/BajaSur  Mexico/General
    Europe/Athens  Europe/Berlin  Europe/Dublin  Europe/Helsinki  Europe/Kiev   Europe/Lisbon
    Europe/London  Europe/Madrid  Europe/Moscow  Europe/Oslo      Europe/Paris  Europe/Rome
    Europe/Stockholm  Europe/Zurich
    GMT  GMT+00:00
    GMT+01:00  GMT+02:00  GMT+03:00  GMT+04:00  GMT+05:00  GMT+05:30  GMT+06:00  GMT+06:30  GMT+07:00
    GMT+08:00  GMT+09:00  GMT+10:00  GMT+11:00  GMT+12:00  GMT+13:00  GMT+14:00  
    GMT-01:00  GMT-02:00  GMT-03:00  GMT-04:00  GMT-05:00             GMT-06:00             GMT-07:00
    GMT-08:00  GMT-09:00  GMT-10:00  GMT-11:00  GMT-12:00
</TimeZones>

<!-- ================================================================================= -->
<!-- localhost ============================================================== -->
<!--
Notes:
* Make sure you replace all occurances of "example.com" below with your own domain name.
* The 'host' attribute on the 'Domain' tag specifies to which webserver domain name the 'Domain' 
  definition refers.  Specifying 'host="*"' indicates that this 'Domain' tag should be considered 
  the default PrivateLabel Domain definition for all connections made to the server.  You may create 
  multiple 'Domain' definitions, each with their own set of attributes and features.
* The OpenGTS system has the ability to bind Account records to a specific PrivateLabel domain 
  (defined by a "Domain" tag below). This is done to provide specific access control to certain 
  services such as mapping and reverse-geocoding. (ie. when a device connects to the server to send 
  data, the PrivateLabel defined for the account is used to determine which reverse-geocoding service 
  to use to create an address from the latitude/longitude). To bind an account record to a specific 
  PrivateLabel 'Domain', set the 'privateLabelName' column in the specific account record to the 
  specified 'name' of the Domain (ie. the value of the 'name' attribute).  If an account record 
  'privateLabelName' has not been specified (ie. is blank), then the services defined in the default